id|nome|sku|descricao|imagem|preco|marca|alturaProduto|larguraProduto|pesoBruto|profundidadeProduto|categoria
101493|Desodorante Antitranspirante Rollon Dove Original 50ml|3915745|"""¿	O Desodorante Antitranspirante Roll-On Dove Original protege por até 48 horas contra o suor e mau odor.¿	Este desodorante roll-on contém o exclusivo 1/4 de creme hidratante Dove com óleo protetor, para hidratar a pele das axilas.¿	Garante proteção antitranspirante eficaz e o melhor cuidado¹ para proteger a pele das axilas, com conforto e sem irritação.¿	Dove Original é um desodorante antitranspirante sem álcool e dermatologicamente testado, gentil com a pele.¿	Além de proteger contra o suor e mau odor, o antitranspirante Dove Original possui uma fragrância clássica e delicada, para uma sensação de limpeza e frescor.¿	O nosso desodorante feminino é certificado como Cruelty-free pela PETA, o que garante que Dove não realiza testes em animais.Quer saber como ter uma pele macia sem comprometer a proteção? Nós temos a resposta. O Desodorante Antitranspirante Roll-On Dove Original oferece 48 horas de proteção eficaz e deixa a pele mais suave.Elaborada com ¼ de creme hidratante com óleo protetor, essa fórmula contribui para a hidratação diária da pele, deixando as axilas macias e suaves. Além disso, ajuda a reduzir a irritação causada pela depilação. Com nossa fragrância clássica, ele ajudará você a se sentir confiante e confortável diante de qualquer obstáculo.Nossa missão é elevar a autoestima e o potencial das mulheres, porque a beleza deve trazer confiança, não ansiedade. Este Desodorante Antitranspirante Roll-On Dove Original oferece proteção eficaz e é suave na pele para que você possa cuidar das axilas como desejar e com total confiança.Dove é certificada Cruelty-Free pela PETA, sendo assim, você pode confiar que não realizamos e nem realizaremos testes em animais em nenhum lugar do mundo. Com notas sutis e frescas, a clássica fragrância de Dove adicionará um toque de conforto e uma sensação de limpeza à sua rotina de cuidados.Aplique o desodorante antitranspirante Dove fazendo movimentos circulares de modo a cobrir toda a região da axila com uma camada fina e uniforme do produto.¹comparado com os principais concorrentes do mercado."""|https://static.paodeacucar.com/img/uploads/1/977/24151977.jpg|11.99|Dove|10.9|4.1|80.0|4.1|cuidados-pessoais
568596|Papel Higiênico NEVE Supreme Folha Tripla 12 Rolos|1266606||https://static.paodeacucar.com/img/uploads/1/675/12893675.jpg|29.13|Neve|24.7|22.6|1102.0|20|cuidados-pessoais
1376293|Desodorante Aerosol Rexona Men Invisible 250ml|1324069||https://static.paodeacucar.com/img/uploads/1/0/23723000.jpg|22.49|Rexona|20.6|5|193.0|5|cuidados-pessoais
35935|Desodorante Antitranspirante Aerosol Dove Original 150ml|3447482|"""¿ O Desodorante Antitranspirante Aerosol Dove Original contém 1/4 de creme hidratante e vitamina E, para axilas ainda mais suaves e macias, com resultados desde o primeiro uso ¿ Com tecnologia superior, o antitranspirante Dove garante proteção contra o suor e mau odor por 72h, mantendo as axilas secas e perfumadas ¿ Dove Original é um desodorante antitranspirante sem álcool** em sua fórmula, que ajuda a pele a se recuperar de qualquer irritação causada pela depilação ¿ Este desodorante aerosol de rápida absorção e delicado para suas axilas é o número 1 em cuidado* para a sua pele ¿ Além de proteger contra o suor e mau odor, possui uma fragrância clássica e delicada para uma sensação de limpeza e frescor ¿ Dove não realiza testes em animais, sendo certificada como Cruelty-Free pela PETA. Este aerosol é vegano.¿ Não danifica a camada de ozônio e nossas latas são feitas de metal reciclável Formulado com ¼ de creme hidratante e enriquecido com vitamina E.O Desodorante Antitranspirante Aerosol Dove Original ajuda a manter a hidratação da pele das axilas, deixando-a suave, macia e protegida para a pré e pós depilação, com resultados visíveis desde o primeiro uso. Feito com tecnologia superior, repara, cuida e protege as axilas por 72 horas contra suor e mau odor, mantendo as axilas secas o dia todo. Este desodorante foi eleito o número 1 em cuidado* da pele das axilas pelas nossas consumidoras. Dove Original é um desodorante antitranspirante sem álcool** em sua fórmula e é gentil com a sua pele. Este desodorante, além de proteger contra suor e mau odor, possui uma fragrância clássica e delicada, para uma sensação de limpeza e frescor. Dove proporciona proteção eficaz e cuidado para a pele das axilas, para que você possa se libertar de qualquer inibição e se sentir confiante o dia todo. Para uma melhor proteção contra marcas de suor e irritação da pele, siga estas dicas: após o banho, garanta que as axilas estejam bem secas; para obter o máximo do seu Desodorante Antitranspirante Aerosol Dove Original, agite a embalagem para ativar os ingredientes; segure-a voltada para cima a 15 cm das suas axilas e aplique um jato de dois segundos em cada uma. Dove é certificada Cruelty-Free pela PETA, sendo assim, não realizamos e nem realizaremos testes em animais em nenhum lugar do mundo. Além disso, nosso antitranspirante é vegano, fabricado com energia elétrica 100% renovável, nossa lata é feita de metal reciclável e o produto não danifica a camada de ozônio. *Antitranspirante Aerosol mais vendido do mercado de desodorantes no Brasil (Nielsen Retail Index INA+INFC, Novembro 2021 a Outubro 2022). **Não contém álcool etílico."""|https://static.paodeacucar.com/img/uploads/1/217/25022217.jpg|19.49|Dove|17.8|4.5|134.0|4.5|cuidados-pessoais
337821|Papel Higiênico Neve Supreme Leve 16 Pague 15 - 16 Rolos|1085519|Papel higiênico neutro folha tripla de alta qualidade. Neve quer ajudar as pessoas a cuidarem de si, por isso desenvolveu um produto que proporciona maciez insuperável com mais absorção e resistência. Benefícios: Higiene e conforto superior para todos os dias, Mantém o pH Natural da pele¹ (Tecnologia Dermacare), O cuidado de Neve em folha tripla para toda a família. 1. Por não interferir nas condições naturais da pele. Embalagem econômica; Quantidade por pacote: 16 rolos|https://static.paodeacucar.com/img/uploads/1/35/12886035.jpg|38.41|Neve|24.5|31|1469.0|20|cuidados-pessoais
411008|Sabonete Liquido LUX  Buque de Jasmim Refil 200 ML|1149610|"""¿ Seu banho um momento único, especial e relaxante. ¿ Com óleos hidraflorais e extrato de Jasmim. ¿ Sensação de uma pele com um toque aveludado. ¿ Uma variedade de ingredientes botânicos naturais. ¿ Com glicerina. ¿ Sem parabenos. Os sabonetes líquidos Lux são formulados de forma a proporcionar uma experiência do seu banho um momento único, especial e relaxante. Com fragrâncias inspiradas na natureza, Lux valoriza o momento do banho, para te entregar uma experiência ainda melhor. Lux também possui óleos hidraflorais, uma mistura de ingredientes de cuidado com a pele, extraídos da natureza, que adicionados à formulação ajudam a sua pele a permanecer macia e flexível. Aproveite um banho ainda mais intenso com Lux. Além disso, a linha de sabonetes líquidos de Lux apresenta um pH adequado à sua pele, promovendo uma limpeza eficaz e cuidado com a sua pele. Para uma melhor experiência de uso e rendimento do produto, sugerimos as seguintes formas de uso: ¿ Apenas um pouco do produto na esponja é capaz de lavar o corpo inteiro; ¿ Banho com esponja: Colocar uma pequena quantidade de produto na esponja (5ml) e passar suavemente pelo corpo; ¿ Banho sem esponja: Aplicar uma pequena quantidade de produto nas mãos, fora da água, fazer a espuma e aplicar no corpo. Experimente também o sabonete em barra Buquê de Jasmim, disponível nos tamanhos 85g e 125g. Conheça outros sabonetes líquidos Lux: Flor de Verbena, Orquídea Negra, Rosas Francesas, Flor de Lótus e Lavanda. Todas os sabonetes Lux são exclusivamente formulados para uma experiência maravilhosa no banho, através dos exclusivos óleos hidraflorais e da glicerina. Mude o toque da sua pele com os sabonetes líquido Lux, disponíveis em 6 incríveis variantes."""|https://static.paodeacucar.com/img/uploads/1/544/24276544.jpg|5.99|Lux|17|10|212.9|3.6|cuidados-pessoais
19468|Desodorante Antitranspirante Aerosol Feminino REXONA Powder Dry 72 horas 150ml|3665800|"""¿	O Desodorante Aerosol Feminino Rexona Powder Dry possui nova fórmula com 72 horas de proteção contra a transpiração e o mau odor, ativada pelo movimento¿	Sua fórmula não contém álcool etílico e a fragrância desse antitranspirante contém uma combinação única de jasmim e baunilha, garantindo a sensação de frescor durante o dia inteiro¿	Agite antes de usar. Aplicar o Desodorante Feminino Rexona Powder Dry somente nas axilas a não menos de 15 cm da pele¿	O novo desodorante feminino Rexona responde diretamente ao seu movimento, mantendo você seca, fresca e protegida como nunca¿	Este desodorante aerosol não afeta a camada de ozônio, possui lata em alumínio 100% reciclável e é feito com energia elétrica 100% renovável¿	Antitranspirante aerosol que mantém você seca, fresca e protegida a cada novo movimento e por muito mais tempo. Rexona não te abandonaMais uma vez Rexona se supera e relança sua linha de desodorantes com uma fórmula inovadora, o Desodorante Aerosol Feminino Rexona Powder Dry combina um novo e exclusivo ativo antitranspirante com a tecnologia de fragrâncias encapsuladas. Esse desodorante antitranspirante aerosol a mantém protegida por até 72 horas, ativado pelo seu movimento e a deixa muito mais confiante para você encarar qualquer desafio. Com o registro de 16 patentes e mais de 300 testes técnicos, está comprovado que essa nova tecnologia antitranspirante entrega um nível de proteção contra o suor como nenhuma outra proposta regular já entregou antes. A nova e exclusiva fórmula de Rexona Powder Dry trabalha com um sistema de partículas menores e mais estáveis que formam uma barreira protetora mais resistente e duradoura contra a transpiração e o mau odor, mantendo você seca, refrescada e protegida a cada novo movimento e por muito mais tempo. Sua fragrância contém uma combinação única de jasmim e baunilha, garantindo a sensação de frescor durante o dia inteiro. A lata usada no antitranspirante aerosol é feita de alumínio 100% reciclável, e o produto é feito com energia elétrica 100% renovável, não contém álcool etílico e não afeta a camada de ozônio. Experimente também outros produtos da linha de desodorantes aerosol femininos Rexona e se sinta sempre protegida durante qualquer atividade. Por que Rexona não te abandona."""|https://static.paodeacucar.com/img/uploads/1/137/24267137.jpg|15.79|Rexona|17.2|4.5|132.0|4.5|cuidados-pessoais
462051|Papel Higiênico Folha Dupla Mimmo Leve 12 pague 11 rolos|1229655||https://static.paodeacucar.com/img/uploads/1/220/656220.jpg|17.99|Mimmo|20|23.4|1115.0|25.6|cuidados-pessoais
409355|NIVEA Sabonete em Barra Erva Doce & Óleos 85g|1147217|"""O que é?Sabonete erva doce em barra para cuidar da sua pele durante o banho. Experiência única de carinho. Garanta a sua!Para que serve o Sabonete em Barra Hidratante Nivea Erva Doce & Óleos?Com óleos vegetais na sua fórmula, limpa e hidrata a pele. A deliciosa fragrância de erva-doce promove frescor e cuidado.Benefícios e diferenciais- Com hidratante- Fragrância deliciosa de erva-doce- Sabonete glicerinado- Dermatologicamente testadoComo usar o Sabonete em Barra Nivea Erva Doce & Óleos?Massageie suavemente na pele molhada até formar espuma. Enxágue com água em abundância.Uma unidade de embalagem contém 85g"""|https://static.paodeacucar.com/img/uploads/1/95/24491095.jpg|3.99|Nivea|5.5|9|88.0|2.9|cuidados-pessoais
27050|Sabonete Barra de Glicerina Castanha-do-Brasil Granado Terrapeutics Caixa 90g |3507131|Composição:Ácido esteárico, óleo vegetal de coco, Hidróxido de sódio, sacarose, água, glicerina vegetal, propilenoglicol, extrato de castanha do Pará, EDTA dissódico, ácido etidrônico, fragrância, corante, álcool etílico, sulfato de sódio.|https://static.paodeacucar.com/img/uploads/1/3/24133003.png|6.49|Granado|8.71|6.05|108.0|3.22|cuidados-pessoais
153708|Papel Higiênico Folha Dupla Neutro PERSONAL Vip Leve 24 e Pague 22|4221074|Informação Adicional:Componentes atóxicos. Não propensos a  causar irritação em contato com a pele.|https://static.paodeacucar.com/img/uploads/1/680/669680.jpg|34.99|Personal|30.335|30.138|2206.0|23.216|cuidados-pessoais
173595|Desodorante Antitranspirante Aerosol Nívea Invisible Black & White Clear 150ml|4537786|"""O que é?Desodorante antitranspirante que garante proteção eficaz por 48h e evita manchas nas roupas. Você livre de manchas, suor e mau odor. Confira!Para que serve o Desodorante Aerosol Nivea Invisible Black & White Clear?Poderosa fórmula elimina 99,9% das bactérias da pele e evita manchas brancas em roupas pretas e manchas amarelas em roupas brancas. Benefícios e diferenciais- A melhor proteção contra manchas e suor- 2x mais agentes antitranspirantes e minerais- Sem álcool etílico e corantesComo usar o Desodorante Aerosol Nivea Invisible Black & White Clear?Agite bem antes de usar. Ao aplicar o produto, mantenha o frasco a aprox. 15 cm da axila. Espere secar antes de se vestir.Uma unidade de embalagem contém 150ml"""|https://static.paodeacucar.com/img/uploads/1/61/24491061.jpg|16.99|Nivea|16.6|4.5|127.5|4.5|cuidados-pessoais
398436|Papel Higiênico Folha Dupla Neutro Qualitá 30m Pacote Leve 12 Pague 11 Unidades|1133036||https://static.paodeacucar.com/img/uploads/1/651/32842651.png|23.99|Qualitá|20|31|1080.0|21|cuidados-pessoais
282114|Sabonete Em Barra DOVE Karite E Baunilha 90g Pack Com 6 Unidades|1024632|"""¿ O Sabonete em Barra Dove Karité e Baunilha contém 1/4 de creme hidratante e agentes de limpeza suaves que ajudam a proteger a hidratação natural da pele¿ Dove Karité e Baunilha contém pH neutro, não interferindo no próprio pH da pele, para que você não precise se preocupar com o ressecamento da pele¿ O Sabonete em Barra Dove Karité e Baunilha não é um sabonete comum, é um sabonete que ajuda na hidratação da pele¿ O Sabonete em Barra Dove Karité e Baunilha possui manteiga de karité, com propriedades hidratantes e uma deliciosa fragrância de baunilha¿ Com uma fórmula de limpeza suave, este sabonete em barra deixa a sua pele macia, bonita e com aspecto saudável¿ O Sabonete em Barra Dove Karité e Baunilha é dermatologicamente recomendadoDove não é um simples sabonete em barra comum. É um sabonete de beleza que vai além da limpeza, nutrindo a pele enquanto remove a sujeira do dia a dia. O Sabonete em Barra Dove Karité e Baunilha faz uma espuma cremosa e deixa a sua pele com uma sensação renovada. Acreditamos que o segredo para uma pele bonita é a hidratação diária, e nenhum sabonete comum hidrata melhor do que Dove. Este sabonete em barra combina uma fórmula de limpeza suave com 1/4 de creme hidratante, deixando a sua pele macia, bem cuidada e com a aparência saudável. O Sabonete Dove Original não retira a hidratação natural da sua pele como os sabonetes em barra comuns: sua composição com 1/4 de creme hidratante ajuda a repor os nutrientes da pele deixando-a mais bem nutrida e hidratada. Os benefícios da manteiga de karité para a pele são conhecidos há muitos anos: sua concentração de vitaminas e ácidos graxos tem propriedades hidratantes. Sua fórmula nutre e hidrata a pele enquanto limpa, deixando-a com uma sensação macia e bem cuidada. Para uma melhor experiência no banho, sugerimos o seguinte modo de uso: primeiro, molhe as mãos e passe o Sabonete Dove Karité e Baunilha entre elas, até formar uma espuma. Em seguida, massageie a espuma pelo seu corpo e, por último, enxágue com água morna. O Sabonete Dove Karité e Baunilha não vai deixar a sua pele seca e áspera como os sabonetes comuns fazem, e você pode usá-lo diariamente no rosto, mãos e no corpo. O Sabonete Dove Karité e Baunilha é dermatologicamente recomendado. Dove é certificada Cruelty-Free pela PETA, sendo assim, não realizamos e nem realizaremos testes em animais em nenhum lugar do mundo. Você pode ser fã do Sabonete Dove Karité e Baunilha, mas com tantas opções, por que não experimentar todos? Afinal, temos um sabonete para cada momento."""|https://static.paodeacucar.com/img/uploads/1/704/24155704.jpg|19.99|Dove|8.4|18|609.0|6.4|cuidados-pessoais
217087|Sabonete Antibacteriano em Barra Protex Nutri Protect Vitamina E 85g|4944003|Protex® Nutri Protect Vitamina E oferece proteção antibacteriana natural com óleo de linhaça e elimina 99,9% das bactérias, garantindo proteção por até 12 horas.Benefícios:Para a boa saúde e nutrição da sua peleElimina 99,9%** das bactérias e vírus da COVID-19*Fórmula exclusiva com pH balanceado, ajuda a limpar e remover as impurezas da peleCria uma barreira de proteção que ajuda a prevenir a proliferação de bactériasDermatologicamente testadoProteção antibacteriana natural com óleo de linhaçaINGREDIENTES: Sodium Oleate / Sodium Palmitate / Sodium Laurate (Jabón de sodio), Aqua, Glycerin, Parfum, Sodium Chloride, Linum Usitatissimum (Linseed) Seed Oil, Tocopheryl Acetate [Vitamina E], Titanium Dioxide, Prunus Amygdalus Dulcis (Sweet Almond) Oil, Canola Oil, Camellia Sinensis Leaf Oil, Helianthus Annuus (Sunflower) Seed Oil, Tetrasodium EDTA, Etidronic Acid, Camellia Oleifera Seed Oil, CI 47005, CI 15510, Rosmarinus Officinalis (Rosemary) Extract, Hexyl Cinnamal, Benzyl Salicylate, Butylphenyl Methylpropional, Linalool, Geraniol, Citronellol, Coumarin, Alpha-Isomethyl Ionone.|https://static.paodeacucar.com/img/uploads/1/655/24361655.jpg|3.69|Protex|5|8.2|86.3|3|cuidados-pessoais
467613|NIVEA Sabonete Líquido Refil Erva Doce 200ml|1233942|O sabonete líquido NIVEA Erva Doce Refil limpa e hidrata a pele e ainda deixa com uma fragrância refrescante de Erva Doce. Confira +detalhes!Para que serve o Sabonete Líquido NIVEA Erva Doce?Ideal para o uso diário e indicado para todos os tipos de pele. Sua fórmula garante sensação de pele macia e hidratada. Possui óleo essencial de amêndoas.Benefícios e diferenciais- Fragrância refrescante e duradoura de erva-doce- Equilíbrio com o pH da pele- Dermatologicamente testado- Rende mais de 60 banhos- 76% menos plásticoComo usar o Sabonete Líquido NIVEA Erva Doce?Massageie suavemente na pele molhada até formar uma espuma. Enxágue com água em abundância.Uma unidade de embalagem contém 200ml|https://static.paodeacucar.com/img/uploads/1/665/22037665.jpg|8.29|Nivea|17.5|8.3|207.0|5.3|cuidados-pessoais
290020|Desodorante Antitranspirante Roll-On Dove Invisible Dry 50ml|1032835|"""¿ O Desodorante Antitranspirante Roll-On Dove Invisible Dry não deixa manchas brancas nas roupas, testado em 100 cores de tecidos¿ Este desodorante feminino contém 1/4 de creme hidratante Dove com óleo protetor que contribui para a hidratação diária da pele, deixando as axilas macias e suaves¿ Antitranspirante que garante proteção contra suor e mau odor por até 48h, e cuidado da pele das axilas sem deixar manchas brancas nas suas roupas¿ Dove Invisible Dry é um desodorante antitranspirante roll-on de fácil aplicação, que possui uma delicada fragrância floral, para uma sensação de limpeza e frescor¿ Além de proteger contra o suor e mau odor, este desodorante feminino contém 0% álcool* e é dermatologicamente testado, gentil com a pele¿ O nosso desodorante feminino é certificado como Cruelty-Free pela PETA, o que garante que Dove não realiza nem realizará testes em animais em nenhum lugar do mundoQuer saber como ter uma pele macia sem comprometer a proteção ou sua roupa? O Desodorante Antitranspirante Roll-On Dove Invisible Dry foi desenvolvido para não deixar manchas brancas de desodorante na roupa e oferece até 48 horas de proteção eficaz, deixando a pele mais suave. Elaborada com ¼ de creme hidratante com óleo protetor, essa fórmula contribui para a hidratação diária da pele, deixando as axilas macias e suaves. Este desodorante antitranspirante é eficaz contra suor e mau odor, deixando a pele com sensação limpa e fresca através das notas de violeta e frésia branca em sua fragrância. Tudo isso sem deixar manchas brancas em 100 cores de tecidos. Este desodorante feminino é sem álcool* e dermatologicamente testado. Nossa missão é elevar a autoestima das mulheres para alcançarem o seu máximo potencial. O Desodorante Antitranspirante Roll-On Dove Invisible Dry oferece proteção eficaz e cuidado para a pele, respeitando a pluralidade de axilas, para você se libertar de qualquer inibição e se sentir confiante o dia todo. Aplique o desodorante antitranspirante Dove fazendo movimentos circulares de modo a cobrir toda a região da axila com uma camada fina e uniforme do produto. Dove é certificada Cruelty-Free pela PETA, sendo assim, você pode confiar que não realizamos e nem realizaremos testes em animais em nenhum lugar do mundo. *Não contém álcool etílico."""|https://static.paodeacucar.com/img/uploads/1/834/12091834.jpg|7.99|Dove Men|11.2|4.6|80.0|4.3|cuidados-pessoais
1591027|Sabonete Barra Água de Coco Francis Brasilidades Flow Pack 80g|1370376||https://static.paodeacucar.com/img/uploads/1/399/24964399.jpg|2.99|Francis|8.6|11|84.36|2.4|cuidados-pessoais
711969|Papel Higiênico Folha Dupla Neutro Qualitá 30m Pacote Leve 16 Pague 15 Unidades|1310325||https://static.paodeacucar.com/img/uploads/1/652/32842652.png|31.99|Qualitá|26|31|1675.0|20|cuidados-pessoais
284478|Papel Higiênico Folha Dupla Neutro Personal Vip 30m Pacote Leve 12 Pague 11 Unidades|1028238||https://static.paodeacucar.com/img/uploads/1/619/29617619.png|26.49|Personal|20.7|22.4|1025.0|25|cuidados-pessoais
84242|Papel Higiênico Folha Dupla Neutro PERSONAL Vip Leve 16 Pague 15 Unidades|6694937|Composição:100% de fibras naturais.|https://static.paodeacucar.com/img/uploads/1/681/669681.jpg|33.37|Personal|20.5|31|1471.0|23.6|cuidados-pessoais
347653|Desodorante Antitranspirante Aerosol Dove Go Fresh Romã e Verbena 150ml|1111779|"""¿ O Desodorante Antitranspirante Aerosol Dove Go Fresh Romã e Verbena possui uma deliciosa e refrescante fragrância que dura o dia todo¿ Com tecnologia superior, o antitranspirante Dove garante proteção contra o suor e mau odor por até 72h, dando uma sensação de limpeza e frescor revitalizante¿ Dove Romã e Verbena é um desodorante antitranspirante sem álcool** em sua fórmula¿ Este desodorante aerosol de rápida absorção e delicado para suas axilas é o número 1 em cuidado* para a sua pele¿ Contém ¼ de creme hidratante e vitamina E, além de uma agradável fragrância de romã e verbena¿ Dove não realiza testes em animais, sendo certificada como Cruelty-Free pela PETA. Este aerosol é vegano, não danifica a camada de ozônio e nossas latas são feitas de metal reciclávelNúmero 1 em cuidado*, o Desodorante Antitranspirante Aerosol Dove Go Fresh Romã e Verbena é o preferido das nossas consumidoras. Feito com tecnologia superior, ele cuida e protege das axilas por 72 horas contra suor e mau odor, mantendo as axilas secas o dia todo. Formulado com 1/4 de creme hidratante e vitamina E, ajuda a manter a hidratação da pele das axilas, deixando-a suave e macia. O desodorante Dove Go Fresh é sem álcool** e gentil com sua pele. Além de proteger contra suor e mau odor, possui uma fragrância de romã e verbena, oferecendo uma sensação de limpeza e frescor revitalizante. Dove proporciona proteção eficaz e cuidado para a pele das axilas, para que você possa se libertar de qualquer desconforto e se sentir confiante o dia todo. Para uma melhor proteção contra marcas de suor e irritação da pele, siga estas dicas: após o banho, garanta que as axilas estão bem secas; para obter o máximo do seu Desodorante Antitranspirante Aerosol Dove Go Fresh Romã e Verbena, agite a embalagem para ativar os ingredientes; segure-a voltada para cima a 15 cm das suas axilas e aplique um jato de dois segundos em cada uma. Dove é certificada Cruelty-Free pela PETA, sendo assim, não realizamos e nem realizaremos testes em animais em nenhum lugar do mundo. Além disso, nosso antitranspirante é vegano, fabricado com energia elétrica 100% renovável, nossa lata é feita de metal reciclável e o produto não danifica a camada de ozônio. *Antitranspirante Aerosol mais vendido do mercado de desodorantes no Brasil (Nielsen Retail Index INA+INFC, Novembro 2021 a Outubro 2022). **Não contém álcool etílico."""|https://static.paodeacucar.com/img/uploads/1/127/25022127.jpg|19.49|Dove|17.8|4.5|134.0|4.5|cuidados-pessoais
